{
  "$schema": "https://json-schema.org/draft/2020-12/schema",
  "$id": "https://radar.hecavex.com/data/schemas/observed-hostname-part-v1.schema.json",
  "title": "HECAVEX Radar observed hostname partition v1",
  "type": "array",
  "minItems": 1,
  "maxItems": 25000,
  "items": {
    "$schema": "https://json-schema.org/draft/2020-12/schema",
    "$id": "https://radar.hecavex.com/data/schemas/observed-hostname-v1.schema.json",
    "title": "HECAVEX Radar observed hostname v1",
    "type": "object",
    "additionalProperties": false,
    "required": [
      "id",
      "domain",
      "domainGroup",
      "brand",
      "firstSeen",
      "lastSeen",
      "firstRecordedAt",
      "firstPublishedAt",
      "observedDays",
      "observedDayLastSeen",
      "sources",
      "match",
      "assessment",
      "recordAvailable"
    ],
    "properties": {
      "id": {
        "type": "string",
        "maxLength": 160,
        "pattern": "^[a-f0-9]{20}$"
      },
      "domain": {
        "type": "string",
        "maxLength": 512,
        "pattern": "^[a-z0-9-]+(?:\\[\\.\\][a-z0-9-]+)+$"
      },
      "domainGroup": {
        "type": "string",
        "maxLength": 512,
        "pattern": "^[a-z0-9-]+(?:\\[\\.\\][a-z0-9-]+)+$"
      },
      "brand": {
        "type": "string",
        "minLength": 1,
        "maxLength": 120
      },
      "firstSeen": {
        "type": "string",
        "maxLength": 160,
        "pattern": "^\\d{4}-\\d{2}-\\d{2}T\\d{2}:\\d{2}:\\d{2}\\.\\d{3}Z$"
      },
      "lastSeen": {
        "type": "string",
        "maxLength": 160,
        "pattern": "^\\d{4}-\\d{2}-\\d{2}T\\d{2}:\\d{2}:\\d{2}\\.\\d{3}Z$"
      },
      "firstRecordedAt": {
        "type": [
          "string",
          "null"
        ],
        "maxLength": 160,
        "pattern": "^\\d{4}-\\d{2}-\\d{2}T\\d{2}:\\d{2}:\\d{2}\\.\\d{3}Z$"
      },
      "firstPublishedAt": {
        "type": [
          "string",
          "null"
        ],
        "maxLength": 160,
        "pattern": "^\\d{4}-\\d{2}-\\d{2}T\\d{2}:\\d{2}:\\d{2}\\.\\d{3}Z$"
      },
      "observedDays": {
        "type": "array",
        "uniqueItems": true,
        "maxItems": 36600,
        "items": {
          "type": "string",
          "maxLength": 160,
          "pattern": "^\\d{4}-\\d{2}-\\d{2}$"
        }
      },
      "observedDayLastSeen": {
        "type": "object",
        "maxProperties": 36600,
        "propertyNames": {
          "type": "string",
          "maxLength": 160,
          "pattern": "^\\d{4}-\\d{2}-\\d{2}$"
        },
        "additionalProperties": {
          "type": "string",
          "maxLength": 160,
          "pattern": "^\\d{4}-\\d{2}-\\d{2}T\\d{2}:\\d{2}:\\d{2}\\.\\d{3}Z$"
        }
      },
      "sources": {
        "type": "array",
        "minItems": 1,
        "maxItems": 3,
        "uniqueItems": true,
        "items": {
          "enum": [
            "CertStream",
            "URLScan",
            "HECAVEX"
          ]
        }
      },
      "match": {
        "type": "object",
        "additionalProperties": false,
        "required": [
          "score",
          "reasonCodes",
          "policyVersion"
        ],
        "properties": {
          "score": {
            "type": [
              "integer",
              "null"
            ],
            "minimum": 0,
            "maximum": 100
          },
          "reasonCodes": {
            "type": "array",
            "uniqueItems": true,
            "maxItems": 32,
            "items": {
              "type": "string",
              "pattern": "^[a-z][a-z0-9-]{1,79}$"
            }
          },
          "policyVersion": {
            "type": "string",
            "maxLength": 160
          }
        }
      },
      "assessment": {
        "anyOf": [
          {
            "type": "null"
          },
          {
            "type": "object",
            "additionalProperties": false,
            "required": [
              "verdict",
              "assessedAt",
              "decisionId",
              "analystConfidence",
              "evidenceReferences"
            ],
            "properties": {
              "verdict": {
                "enum": [
                  "malicious",
                  "suspicious",
                  "benign",
                  "inconclusive"
                ]
              },
              "assessedAt": {
                "type": "string",
                "maxLength": 160,
                "pattern": "^\\d{4}-\\d{2}-\\d{2}T\\d{2}:\\d{2}:\\d{2}\\.\\d{3}Z$"
              },
              "decisionId": {
                "type": "string",
                "maxLength": 160,
                "pattern": "^[a-f0-9]{24}$"
              },
              "analystConfidence": {
                "type": [
                  "integer",
                  "null"
                ],
                "minimum": 0,
                "maximum": 100
              },
              "evidenceReferences": {
                "type": "array",
                "minItems": 1,
                "maxItems": 64,
                "uniqueItems": true,
                "items": {
                  "type": "string",
                  "minLength": 1,
                  "maxLength": 512
                }
              }
            }
          }
        ]
      },
      "recordAvailable": {
        "type": "boolean"
      },
      "sourceTimeProvenances": {
        "type": "array",
        "minItems": 1,
        "maxItems": 3,
        "uniqueItems": true,
        "items": {
          "enum": [
            "provider-observation-time",
            "collector-time-fallback",
            "legacy-normalized-unknown"
          ]
        }
      }
    }
  }
}
