[{"assessment":null,"brand":"Vinted","domain":"vinted-verify[.]shop","domainGroup":"vinted-verify[.]shop","firstPublishedAt":"2026-10-21T15:24:52.842Z","firstRecordedAt":"2026-10-21T15:01:38.857Z","firstSeen":"2026-10-21T14:58:51.476Z","id":"d14d13f3a43757ca9403","lastSeen":"2026-10-23T20:22:24.152Z","match":{"policyVersion":"sha256:38fb3c94f6240732e0d5133b4c5cbe4fbb0995e3408df6653468f223b88ffab6","reasonCodes":["brand-exact-token","different-tld","suspicious-context"],"score":100},"observedDayLastSeen":{"2026-10-21":"2026-10-21T14:58:53.165Z","2026-10-22":"2026-10-22T05:41:45.446Z","2026-10-23":"2026-10-23T20:22:24.152Z"},"observedDays":["2026-10-21","2026-10-22","2026-10-23"],"recordAvailable":true,"sourceTimeProvenances":["collector-time-fallback","provider-observation-time"],"sources":["CertStream","URLScan"]},{"assessment":null,"brand":"Bitė","domain":"wg[.]k-20[.]bite-service[.]com","domainGroup":"bite-service[.]com","firstPublishedAt":null,"firstRecordedAt":null,"firstSeen":"2026-09-09T15:26:59.513Z","id":"d1621ff300d96fac0581","lastSeen":"2026-09-09T15:26:59.513Z","match":{"policyVersion":"sha256:38fb3c94f6240732e0d5133b4c5cbe4fbb0995e3408df6653468f223b88ffab6","reasonCodes":["brand-exact-token","different-tld","multiple-hyphens","suspicious-context"],"score":95},"observedDayLastSeen":{"2026-09-09":"2026-09-09T15:26:59.513Z"},"observedDays":["2026-09-09"],"recordAvailable":true,"sourceTimeProvenances":["legacy-normalized-unknown"],"sources":["CertStream"]},{"assessment":null,"brand":"Artea","domain":"arteaonline[.]it","domainGroup":"arteaonline[.]it","firstPublishedAt":null,"firstRecordedAt":"2026-10-22T15:21:08.381Z","firstSeen":"2026-10-22T14:47:32.088Z","id":"d16ffd67c65a42e20d27","lastSeen":"2026-10-22T14:47:32.088Z","match":{"policyVersion":"sha256:38fb3c94f6240732e0d5133b4c5cbe4fbb0995e3408df6653468f223b88ffab6","reasonCodes":["brand-joined-affix","different-tld","suspicious-context"],"score":98},"observedDayLastSeen":{"2026-10-22":"2026-10-22T14:47:32.088Z"},"observedDays":["2026-10-22"],"recordAvailable":true,"sourceTimeProvenances":["provider-observation-time"],"sources":["CertStream"]},{"assessment":null,"brand":"Telia","domain":"accountingbyatelia[.]com","domainGroup":"accountingbyatelia[.]com","firstPublishedAt":"2026-10-22T06:42:56.406Z","firstRecordedAt":"2026-10-22T06:36:36.340Z","firstSeen":"2026-10-22T06:28:14.088Z","id":"d17f5c4d7dfa4cfe3715","lastSeen":"2026-10-22T06:28:21.291Z","match":{"policyVersion":"sha256:38fb3c94f6240732e0d5133b4c5cbe4fbb0995e3408df6653468f223b88ffab6","reasonCodes":["brand-joined-affix","suspicious-context"],"score":93},"observedDayLastSeen":{"2026-10-22":"2026-10-22T06:28:21.291Z"},"observedDays":["2026-10-22"],"recordAvailable":true,"sourceTimeProvenances":["collector-time-fallback","provider-observation-time"],"sources":["CertStream"]},{"assessment":null,"brand":"Revolut","domain":"webmail[.]revolut-access[.]click","domainGroup":"revolut-access[.]click","firstPublishedAt":"2026-10-18T17:19:23.273Z","firstRecordedAt":"2026-10-18T16:28:07.666Z","firstSeen":"2026-10-18T13:50:29.405Z","id":"d1d790ab0e5977309cdd","lastSeen":"2026-10-18T13:50:29.405Z","match":{"policyVersion":"sha256:38fb3c94f6240732e0d5133b4c5cbe4fbb0995e3408df6653468f223b88ffab6","reasonCodes":["brand-exact-token","different-tld","suspicious-context"],"score":100},"observedDayLastSeen":{"2026-10-18":"2026-10-18T13:50:29.405Z"},"observedDays":["2026-10-18"],"recordAvailable":true,"sourceTimeProvenances":["provider-observation-time"],"sources":["URLScan"]},{"assessment":null,"brand":"DHL","domain":"auth-dhl-shipping-eight[.]vercel[.]app","domainGroup":"auth-dhl-shipping-eight[.]vercel[.]app","firstPublishedAt":null,"firstRecordedAt":null,"firstSeen":"2026-08-23T05:41:59.897Z","id":"d25b05abbdec7d674260","lastSeen":"2026-10-13T14:54:00.796Z","match":{"policyVersion":"sha256:38fb3c94f6240732e0d5133b4c5cbe4fbb0995e3408df6653468f223b88ffab6","reasonCodes":["brand-exact-token","different-tld","multiple-hyphens","suspicious-context"],"score":95},"observedDayLastSeen":{"2026-08-23":"2026-08-23T05:41:59.897Z","2026-10-13":"2026-10-13T14:54:00.796Z"},"observedDays":["2026-08-23","2026-10-13"],"recordAvailable":true,"sourceTimeProvenances":["legacy-normalized-unknown","provider-observation-time"],"sources":["URLScan"]},{"assessment":null,"brand":"Swedbank","domain":"automate-pba[.]dataplatform[.]stage[.]swedbankpay[.]tech","domainGroup":"swedbankpay[.]tech","firstPublishedAt":"2026-10-20T14:01:49.248Z","firstRecordedAt":"2026-10-20T13:55:06.257Z","firstSeen":"2026-10-20T13:27:25.074Z","id":"d29c3ccd2f74d7337394","lastSeen":"2026-10-21T10:02:08.088Z","match":{"policyVersion":"sha256:38fb3c94f6240732e0d5133b4c5cbe4fbb0995e3408df6653468f223b88ffab6","reasonCodes":["brand-joined-affix","different-tld","suspicious-context"],"score":98},"observedDayLastSeen":{"2026-10-20":"2026-10-20T13:27:25.074Z","2026-10-21":"2026-10-21T10:02:08.088Z"},"observedDays":["2026-10-20","2026-10-21"],"recordAvailable":true,"sourceTimeProvenances":["provider-observation-time"],"sources":["CertStream"]},{"assessment":null,"brand":"Revolut","domain":"revolut-pl-support[.]ph","domainGroup":"revolut-pl-support[.]ph","firstPublishedAt":null,"firstRecordedAt":null,"firstSeen":"2026-08-31T22:03:04.566Z","id":"d2d14e7ca052465d6f58","lastSeen":"2026-08-31T22:03:04.566Z","match":{"policyVersion":"sha256:38fb3c94f6240732e0d5133b4c5cbe4fbb0995e3408df6653468f223b88ffab6","reasonCodes":["brand-exact-token","different-tld","multiple-hyphens","suspicious-context"],"score":100},"observedDayLastSeen":{"2026-08-31":"2026-08-31T22:03:04.566Z"},"observedDays":["2026-08-31"],"recordAvailable":true,"sourceTimeProvenances":["legacy-normalized-unknown"],"sources":["CertStream"]},{"assessment":null,"brand":"Vinted","domain":"vinted-checkout[.]info","domainGroup":"vinted-checkout[.]info","firstPublishedAt":"2026-10-20T00:28:48.317Z","firstRecordedAt":"2026-10-19T23:37:57.793Z","firstSeen":"2026-10-19T23:30:39.074Z","id":"d2eb41b8d147c3d25e74","lastSeen":"2026-10-22T19:29:05.727Z","match":{"policyVersion":"sha256:38fb3c94f6240732e0d5133b4c5cbe4fbb0995e3408df6653468f223b88ffab6","reasonCodes":["brand-exact-token","different-tld","suspicious-context"],"score":100},"observedDayLastSeen":{"2026-10-19":"2026-10-19T23:30:47.703Z","2026-10-20":"2026-10-20T07:56:42.728Z","2026-10-22":"2026-10-22T19:29:05.727Z"},"observedDays":["2026-10-19","2026-10-20","2026-10-22"],"recordAvailable":true,"sourceTimeProvenances":["collector-time-fallback","provider-observation-time"],"sources":["CertStream","URLScan"]},{"assessment":null,"brand":"DHL","domain":"dhl-redelivery-service[.]com[.]ph","domainGroup":"dhl-redelivery-service[.]com[.]ph","firstPublishedAt":null,"firstRecordedAt":null,"firstSeen":"2026-08-29T22:00:20.948Z","id":"d30dfb25d4a3d1168771","lastSeen":"2026-08-29T22:00:20.948Z","match":{"policyVersion":"sha256:38fb3c94f6240732e0d5133b4c5cbe4fbb0995e3408df6653468f223b88ffab6","reasonCodes":["brand-exact-token","different-tld","multiple-hyphens","suspicious-context"],"score":95},"observedDayLastSeen":{"2026-08-29":"2026-08-29T22:00:20.948Z"},"observedDays":["2026-08-29"],"recordAvailable":true,"sourceTimeProvenances":["legacy-normalized-unknown"],"sources":["CertStream"]},{"assessment":null,"brand":"Vinted","domain":"vinted-account[.]com","domainGroup":"vinted-account[.]com","firstPublishedAt":null,"firstRecordedAt":null,"firstSeen":"2026-09-27T13:26:10.680Z","id":"d3b509a04596deb17b4b","lastSeen":"2026-09-27T13:26:10.680Z","match":{"policyVersion":"sha256:38fb3c94f6240732e0d5133b4c5cbe4fbb0995e3408df6653468f223b88ffab6","reasonCodes":["brand-exact-token","suspicious-context"],"score":95},"observedDayLastSeen":{"2026-09-27":"2026-09-27T13:26:10.680Z"},"observedDays":["2026-09-27"],"recordAvailable":true,"sourceTimeProvenances":["legacy-normalized-unknown"],"sources":["CertStream"]},{"assessment":null,"brand":"Ignitis","domain":"igniis-property-service[.]pages[.]dev","domainGroup":"igniis-property-service[.]pages[.]dev","firstPublishedAt":null,"firstRecordedAt":"2026-10-23T07:34:22.025Z","firstSeen":"2026-10-23T07:30:10.089Z","id":"d3d7ed8d537fa21489d7","lastSeen":"2026-10-23T07:30:11.327Z","match":{"policyVersion":"sha256:38fb3c94f6240732e0d5133b4c5cbe4fbb0995e3408df6653468f223b88ffab6","reasonCodes":["brand-lookalike-edit","different-tld","multiple-hyphens","suspicious-context"],"score":93},"observedDayLastSeen":{"2026-10-23":"2026-10-23T07:30:11.327Z"},"observedDays":["2026-10-23"],"recordAvailable":true,"sourceTimeProvenances":["collector-time-fallback","provider-observation-time"],"sources":["CertStream"]},{"assessment":null,"brand":"Revolut","domain":"www[.]revolut-user-login[.]ph","domainGroup":"revolut-user-login[.]ph","firstPublishedAt":null,"firstRecordedAt":null,"firstSeen":"2026-09-11T03:37:01.468Z","id":"d3f644e97c293e629337","lastSeen":"2026-09-11T03:37:01.468Z","match":{"policyVersion":"sha256:38fb3c94f6240732e0d5133b4c5cbe4fbb0995e3408df6653468f223b88ffab6","reasonCodes":["brand-exact-token","different-tld","multiple-hyphens","suspicious-context"],"score":100},"observedDayLastSeen":{"2026-09-11":"2026-09-11T03:37:01.468Z"},"observedDays":["2026-09-11"],"recordAvailable":true,"sourceTimeProvenances":["legacy-normalized-unknown"],"sources":["CertStream"]},{"assessment":null,"brand":"Vinted","domain":"vintedverify[.]web[.]id","domainGroup":"vintedverify[.]web[.]id","firstPublishedAt":null,"firstRecordedAt":null,"firstSeen":"2026-10-01T22:06:03.830Z","id":"d3f89275a7106f6d82fa","lastSeen":"2026-10-01T22:06:03.830Z","match":{"policyVersion":"sha256:38fb3c94f6240732e0d5133b4c5cbe4fbb0995e3408df6653468f223b88ffab6","reasonCodes":["brand-joined-affix","different-tld","suspicious-context"],"score":98},"observedDayLastSeen":{"2026-10-01":"2026-10-01T22:06:03.830Z"},"observedDays":["2026-10-01"],"recordAvailable":true,"sourceTimeProvenances":["legacy-normalized-unknown"],"sources":["CertStream"]},{"assessment":null,"brand":"ESO","domain":"eso-security[.]de","domain